{
  "arch": "sm_80",
  "build": {
    "libfakcuda_bytes": 217836,
    "ok": true
  },
  "content_sha256": "dbe7e982157733f44bff91f7b76ca554eb804f42656cff5cc7cd3f2b379b7f57",
  "head_sha": "c53a01c",
  "log_bytes": 1796,
  "machine_id": "a100",
  "model": {
    "name": "glm_moe_dsa",
    "precision": "q8"
  },
  "rc": 0,
  "record_tool": "glm_witness_record.py@1",
  "schema": "glm-gpu-witness/1",
  "tests": [
    {
      "argmax_cpu": 40,
      "argmax_device": 40,
      "class": "approx",
      "cosine": 1.0,
      "gate": null,
      "path_exercised": "all-device GLM-5.2 DSA forward",
      "rc": 0,
      "set_equality": null,
      "test_name": "TestCUDAGLMMoeDsaBackendForward",
      "tier": "sm_80",
      "verdict": "PASS"
    },
    {
      "argmax_cpu": 40,
      "argmax_device": 40,
      "class": "approx",
      "cosine": 1.0,
      "gate": null,
      "path_exercised": "cpu-offload hybrid",
      "rc": 0,
      "set_equality": null,
      "test_name": "TestCUDAGLMDsaCPUOffloadHybrid",
      "tier": "sm_80",
      "verdict": "PASS"
    },
    {
      "argmax_cpu": 40,
      "argmax_device": 40,
      "class": "approx",
      "cosine": 1.0,
      "gate": null,
      "path_exercised": "device index score+topk",
      "rc": 0,
      "set_equality": null,
      "test_name": "TestCUDAGLMMoeDsaIndexSelectMatches",
      "tier": "sm_80",
      "verdict": "PASS"
    }
  ],
  "utc": "2026-06-24T15:59:03Z",
  "verdict": "PASS"
}
